{
  "format": 1,
  "id": "org.jevision.add-line",
  "name": "Add a line",
  "description": "Types a line at the end of the document in front, in TextEdit.",
  "icon": "text.append",
  "version": "1.0.0",
  "author": "JEVision",
  "license": "MIT",
  "minVersion": "0.1.0",
  "inputs": [
    {
      "name": "line",
      "label": "Line to add",
      "default": "- milk"
    }
  ]
}
